"";"."
"1";"ELY QUE ESTÁ DANDO OS NÚMEROS P/ SER CHAMADO, AGE MUITO ESTRANHO - ATENDE BEM ALGUMAS PESSOAS E IGNORA OUTRAS"
"2";"O PESSOAL DA RECEPÇAO (EMERGENCIA) DEVE SER MAIS EDUCADOS. ACORDAM COM PREGUIÇA. TRATA AS PESSOAS MAL"
"3";"SÓ ESTÁ DEMORANDO NO ATENDIMENTO A GENTE ESPERA E AS VEZES NEM E ATENDIDO (EMERGENCIA MÉDICOS)"
"4";"EXISTE ALGUMAS FUNCIONÁRIAS QUE PARECE TRABALHAR SEM VONTADE EX: EU PEDÍ ÁGUA P/ TOMAR E PEDÍ P/ COLOCAR NO FRIGOBAR LOGO APÓS, SÓ QUE A FUNCIONÁRIA COLOCOU ENCIMA DO FRIGOBAR ENVES DE COLOCAR  DENTRO."
"5";"CADEIRA DANIFICADA / BARATA NOS QUARTOS / FALTA TV"
"6";"CHUVEIRO  (DUCHA) COM DEFEITO"
"7";"PACIENTE PERDEU ULTRASOM POR MOTIVO DE NAO ORIENTAÇAO DA ENFERMAGEM"
"8";"CADEIRA COM SITUAÇAO RUIM, UMA TV PARA OS QUARTOS. O PESSOAL DA LIMPEZA ESTAO DEIXANDO A DESEJAR"
"9";"TER TV NO QUARTO. COLOCAR PILHA NO RELOGIOS"
"10";"ACOMPANHANTE RELATA QUE QUANDO PRECISA DE ESCLARECIMENTOS DOS MEDICOS ELES NAO REPASSA, RELATA QUANDO PRECISA FAZER EXAMES FORA DO HOSPITAL ELES NAO AVISA O ACOMPANHANTE"
"11";"A COMIDA NAO É MUITO BOA"
"12";"ACOMPANHANTE RECLAMA QUE DEVERIA TER UMA POLTRONA PARA DESCANSAR, RECLAMA QUE É RUIM DORMIR NA CADEIRA"
"13";"PACIENTE RELATA QUE PEDIU PARA TROCAR DE CAMA QUE ESTA ESTRAGADA E NAO TEVE RESPOSTA"
"14";"FALTA DE INFORMAÇOES NOTURNA PORTARIA"
"15";"A QUALIDADE DOS ALIMENTOS RUIM, FRANGO CRU. ALIMENTOS CRUS"
"16";"FALTA UMA TELEVISAO"
"17";"MELHORAR AS CADEIRAS DOS ACOMPANHANTES"
"18";"A DEMORA PARA CONSULTA E DEMORADA DE MAIS EU ATÉ PENSO A VOUTA PRA MINHA CIDADE QUE E LONGE DAQUI"
"19";"COLOCAR MAIS TELEFONES E PODERIA COLOCAR ZAP PARA MARCAÇAO DE CONSULTAS AJUDARIA TODOS NOS"
"20";"QUE SEJA ATENDIDO NO HORARIO MARCADO"
"21";"PEÇO MELHORAR NA EDUCAÇAO DOS COLABORADORES. CONSULTA MARCADA P/ ÁS 9 HRS VOCE CHEGA ÁS 8 HRS É JÁ SAO 12:40 E N FUI ATENDIDO. PÉSSIMO!   (PACIENTE EDUARDO T. LEMES)"
"22";"PRECISA MELHORAR O ATENDIMENTO MEDICO-PACIENTE. MUITO TEMPO ESPERANDO E QUANDO VAMOS A CONSULTA, RÁPIDA DE MAIS."
"23";"ATENDIMENTO MUITO DEMORADO (MEDICO AMB)"
"24";"LADO NEGATIVO É A DEMORA PARA SER CONSULTADO E O PÉSSIMO ATENDIMENTO NA FARMACIA"
"25";"PESSIMO"
"26";"OBS MUITO DISCAUSO ATRASA MUITO DIFERENCIA MAIS DE DUAS HORAS  ATENDIMENTO MAL NAO MEDE PRENSSAO    (MEDICOS EMERG)"
"27";"PODERIA MELHORAR MAIS AS QUESTOES DA LIMPEZA DOS QUARTOS E BANHEIRO. O ATENDIMENTO DAS ENFERMEIRA TAMBÉM ÁS VEZES DEIXAM A DESEJAR NA MANEIRA QUE É SOLICITADA. E SOBRE OS FUNCIONÁRIOS DA LIMPEZAS DEIXAM MUITO A DESEJAR"
"28";"UM MAQUEIRO FOI EXTREMAMENTE MAL EDUCADO, FUI FALAR COM, ELE FECHOU A PORTA (DA HEMODIALISE) NA MINHA CARA. ELE É MORENO E TEM UMA TATUAGEM DE CRUZ ATRÁS DA ORELHA."
"29";"PRECISAMOS DE DISTRAIR O PACIENTE POR FAVOR COLOQUE UMA TELEVISAO NA RECEPÇAO. O PACIENTE EVITAR DE FICAR ANCIOSO E TER PROBLEMAS FUTUROS"
"30";"PRECISAMOS DE TELEVISAO PARA OS PACIENTES TER MAS COMO SE DISTRAIR E NAO FICAR ANCIOSO PRA NAO DAR PROBLEMAS MAIOR"
"31";"CADE NOSSA TELEVISAO DE DEUS QUANDO TEM A TELEVISAO O TEMPO PASSA MAIS RAPIDO FASSO TRATAMENTO AQUI DESDE 2005 POR FAVOR EU TI PEÇO"
"32";"RECEPÇAO PRECISA DE TV. MEDICOS PRECISA SER MAIS PONTUAIS, POIS OS PACIENTES NAO TEM O TEMPO TODO PRA ESPERAR A BOA VONTADE DO PROFICISSIOCIONAL"
"33";"PODIA COLOCAR MAIS MEDICO PARA O ATENDIMENTO"
"34";"CONFIRMAÇOES P/ QUEM MORA EM OUTRAS CIDADES PODERIA SER NO HORÁRIO DOS ATENDIMENTOS. SOMOS OBRIGADOS A PERMANECER 5 HORAS ÁS VEZES SENDO QUE PODERIAMOS ESPERAR METADE DO TEMPO"
"35";"OS FUMANTES DENTRO DO PÁTIO DO HOSPITAL, ACHO QUE DEVERIA TER FISCALIZAÇAO PROIBINDO DE FUMAR NAS DEPENDENCIAS DOS HOSPITAL"
"36";"DEMORAR MENOS, AS PESSOAS PRECISA TRABALHAR ( MEDICOS AMB)"
"37";"ATENDIMENTO DEVERIA SER NO HORÁRIO (MEDICOS AMB)"
"38";"O TEMPO DE ESPERA PARA UMA PACIENTE ESPECIAL É MTO DESGASTANTE PODERIA SER MAIS RÁPIDO ATENDIMENTO (MEDICO AMB)"
"39";"MELHORAR O AMBIENTE COM MENSAGENS MAIS ALEGRES EM CARTAZES E QUADROS. O TELEAGENDAMENTO 32816161 NUNCA ATENDE MORO FORA E É TAO DIFICIL"
"40";"INSATISFEITO COM A BUROCRACIA PARA CONSULTAS, PACIENTE JÁ AGENDADO PASSANDO MAU, REMARCAM PARA DATAS FUTURAS DESCABIVÉIS , ISSO NAO PODERA CONTINUAR ACONTECENDO, VIDAS NAO ESPERA"
"41";"A PESSOA QUE FICA ENTREGANDO A SENHA NAO SAIA DO LOCAL E SEJA RECEPTIVO"
"42";"COLOCAR MAIS ATENDENTE NA RECEPÇAO"
"43";"TRAZER OS CHEQUINHOS PARA HDT."
"44";"MAIS ORGANIZAÇAO PARA ENTREGA DAS SENHAS. PODERIA SER POR ORDEM DE CHEGADA NA CAIXA DAS SENHAS."
"45";"ATENDIMENTO TELEFONICO A DESEJAR"
"46";"MAIS MEDICOS (AMB)"
"47";"SÓ QUE A SENHORA QUE ENTREGUE A CENHA P/MARCAR COMSULTA É MAL EDUCADA"
"48";"INSATISFEITA COM A UNIDADE POR TER TIRADO OS SERVIÇO DE CHEGUINHO FICOU MUITO DIFÍCIL JÁ QUE SEMPRE TEM MUITOS EXAMES PARA FAZER"
"49";"EU CHEGUEI AS 17:00 HS NO HORÁRIO MARCADO - ISSO FOI NUMA SEXTA FEIRA E A FARMACIA FECHA AS 17:30 HS. FOI UMA CORRERIA PRA PEGAR A RECEITA, POIS IA VIAJAR E MEU REMEIO TINHA ACABADO SUGIRO QUE VERIFIQUE ISSO."
"50";"UM POUCO RUIM PARA OUVIR PELO MICROFONE"
"51";"HOJE ESTAVAM LIXANDO AS PAREDES DA RECEPÇAO JUNTO COM OS PACIENTES, ACHO ISSO UM DESRESPEITO, POIS PODE CAUSAR UMA DOENÇA RESPIRATÓRIA."
